{
  "bundle_metadata": {
    "bundle_id": "wg.authoring.bundle.resilience-first-regional-planning.v1",
    "label": "World Game Resilience-First Regional Planning Pack v1",
    "description": "Reusable resilience-first regional planning templates with network and equity defaults.",
    "status": "draft",
    "template_version": 1,
    "content_version": "1.0.0",
    "deterministic_version_seed": "wg-m10-resilience-first-seed.v1",
    "deterministic_version_hash": "sha256:49529e78c7ed655866498c704d126cf52700a4e125e93418ba3d9512eece33e7",
    "created_at": "2026-03-11T00:00:00Z",
    "updated_at": "2026-03-11T00:00:00Z",
    "tags": [
      "wg-m10",
      "template-pack",
      "resilience-first",
      "regional-planning"
    ]
  },
  "indicator_registries": [
    {
      "registry_id": "registry.wg.authoring.bundle.resilience-first-regional-planning.v1.compact.v1",
      "label": "World Game Resilience-First Regional Planning Pack v1 Compact Indicator Registry",
      "description": "Compact indicator profile for lightweight authoring runs.",
      "indicators": [
        {
          "indicator_id": "equity_score",
          "label": "Equity Score",
          "description": "Distributional fairness across regions.",
          "unit": "index",
          "direction": "higher_is_better",
          "min_value": 0,
          "max_value": 100,
          "weight": 0.16
        },
        {
          "indicator_id": "food_resilience",
          "label": "Food Resilience",
          "description": "Food system reliability under disruption.",
          "unit": "index",
          "direction": "higher_is_better",
          "min_value": 0,
          "max_value": 100,
          "weight": 0.16
        },
        {
          "indicator_id": "logistics_reliability",
          "label": "Logistics Reliability",
          "description": "Corridor continuity and throughput reliability.",
          "unit": "index",
          "direction": "higher_is_better",
          "min_value": 0,
          "max_value": 100,
          "weight": 0.16
        },
        {
          "indicator_id": "water_security",
          "label": "Water Security",
          "description": "Basin-level water security and allocation reliability.",
          "unit": "index",
          "direction": "higher_is_better",
          "min_value": 0,
          "max_value": 100,
          "weight": 0.18
        }
      ]
    },
    {
      "registry_id": "registry.wg.authoring.bundle.resilience-first-regional-planning.v1.full.v1",
      "label": "World Game Resilience-First Regional Planning Pack v1 Full Indicator Registry",
      "description": "Full indicator profile from canonical scenario baseline.",
      "indicators": [
        {
          "indicator_id": "electricity_access",
          "label": "Electricity Access",
          "description": "Reliable electricity service level.",
          "unit": "percent",
          "direction": "higher_is_better",
          "min_value": 0,
          "max_value": 100,
          "weight": 0.2
        },
        {
          "indicator_id": "emissions_intensity",
          "label": "Emissions Intensity",
          "description": "Energy and transport carbon intensity.",
          "unit": "index",
          "direction": "lower_is_better",
          "min_value": 0,
          "max_value": 100,
          "weight": 0.14
        },
        {
          "indicator_id": "equity_score",
          "label": "Equity Score",
          "description": "Distributional fairness across regions.",
          "unit": "index",
          "direction": "higher_is_better",
          "min_value": 0,
          "max_value": 100,
          "weight": 0.16
        },
        {
          "indicator_id": "food_resilience",
          "label": "Food Resilience",
          "description": "Food system reliability under disruption.",
          "unit": "index",
          "direction": "higher_is_better",
          "min_value": 0,
          "max_value": 100,
          "weight": 0.16
        },
        {
          "indicator_id": "logistics_reliability",
          "label": "Logistics Reliability",
          "description": "Corridor continuity and throughput reliability.",
          "unit": "index",
          "direction": "higher_is_better",
          "min_value": 0,
          "max_value": 100,
          "weight": 0.16
        },
        {
          "indicator_id": "water_security",
          "label": "Water Security",
          "description": "Basin-level water security and allocation reliability.",
          "unit": "index",
          "direction": "higher_is_better",
          "min_value": 0,
          "max_value": 100,
          "weight": 0.18
        }
      ]
    }
  ],
  "intervention_libraries": [
    {
      "library_id": "library.wg.authoring.bundle.resilience-first-regional-planning.v1.interventions.v1",
      "label": "World Game Resilience-First Regional Planning Pack v1 Intervention Library",
      "description": "Reusable interventions derived from canonical scenario fixtures.",
      "interventions": [
        {
          "intervention_id": "intervention.basin-efficiency-program",
          "label": "Basin Efficiency Program",
          "description": "Basin-wide efficiency investments for irrigation and industrial reuse.",
          "applicable_regions": [
            "manufacturing_belt",
            "upstream_water_basin"
          ],
          "cost": {
            "amount": 5200,
            "currency": "USDm"
          },
          "prerequisites": [],
          "latency_turns": 0,
          "duration_turns": 2,
          "direct_effects": [
            {
              "region_id": "manufacturing_belt",
              "indicator_id": "food_resilience",
              "delta": 4
            },
            {
              "region_id": "manufacturing_belt",
              "indicator_id": "water_security",
              "delta": 6
            },
            {
              "region_id": "upstream_water_basin",
              "indicator_id": "water_security",
              "delta": 9
            }
          ],
          "tradeoffs": [
            {
              "region_id": "coastal_import_hub",
              "indicator_id": "logistics_reliability",
              "delta": -2,
              "note": "construction disruptions"
            }
          ],
          "policy_dependencies": [],
          "confidence": 0.83
        },
        {
          "intervention_id": "intervention.centralized-transmission-buildout",
          "label": "Centralized Transmission Buildout",
          "description": "Build large centralized transmission and generation corridors.",
          "applicable_regions": [
            "coastal_import_hub",
            "manufacturing_belt",
            "upstream_water_basin"
          ],
          "cost": {
            "amount": 11200,
            "currency": "USDm"
          },
          "prerequisites": [],
          "latency_turns": 1,
          "duration_turns": 3,
          "direct_effects": [
            {
              "region_id": "coastal_import_hub",
              "indicator_id": "electricity_access",
              "delta": 4
            },
            {
              "region_id": "coastal_import_hub",
              "indicator_id": "emissions_intensity",
              "delta": 3
            },
            {
              "region_id": "coastal_import_hub",
              "indicator_id": "logistics_reliability",
              "delta": 3
            },
            {
              "region_id": "manufacturing_belt",
              "indicator_id": "electricity_access",
              "delta": 6
            },
            {
              "region_id": "manufacturing_belt",
              "indicator_id": "logistics_reliability",
              "delta": 4
            }
          ],
          "tradeoffs": [
            {
              "region_id": "upstream_water_basin",
              "indicator_id": "equity_score",
              "delta": -5,
              "note": "benefits exported downstream"
            },
            {
              "region_id": "upstream_water_basin",
              "indicator_id": "water_security",
              "delta": -7,
              "note": "cooling demand and basin extraction"
            }
          ],
          "policy_dependencies": [
            "policy.world-game.approval-thresholds.v1",
            "policy.world-game.equity-guardrail.v1"
          ],
          "confidence": 0.64
        },
        {
          "intervention_id": "intervention.distributed-microgrids",
          "label": "Distributed Microgrids",
          "description": "Deploy distributed microgrids and local storage.",
          "applicable_regions": [
            "manufacturing_belt",
            "upstream_water_basin"
          ],
          "cost": {
            "amount": 7200,
            "currency": "USDm"
          },
          "prerequisites": [],
          "latency_turns": 0,
          "duration_turns": 2,
          "direct_effects": [
            {
              "region_id": "manufacturing_belt",
              "indicator_id": "electricity_access",
              "delta": 4
            },
            {
              "region_id": "manufacturing_belt",
              "indicator_id": "emissions_intensity",
              "delta": -3
            },
            {
              "region_id": "upstream_water_basin",
              "indicator_id": "electricity_access",
              "delta": 5
            },
            {
              "region_id": "upstream_water_basin",
              "indicator_id": "emissions_intensity",
              "delta": -4
            },
            {
              "region_id": "upstream_water_basin",
              "indicator_id": "equity_score",
              "delta": 3
            }
          ],
          "tradeoffs": [
            {
              "region_id": "manufacturing_belt",
              "indicator_id": "equity_score",
              "delta": -2,
              "note": "upfront capex burden"
            }
          ],